Sheet: Sheet1
B2: 34.661
B3: 28.851
B4: 44.756
B5: 31.24
B6: 27.611
B7: 24.47
B8: 40.724
B9: 26.204
B11: 20.52
B12: 11.7013754652083
B13: 19.3224286488239
B14: 14.0718418600172
B15: 13.4556113449619
B16: 5.03181434033049
B17: 18.3148495913987
B18: 12.454057081039
B20: 19.1
B21: 22.53
B22: 18.8
B23: 22.04
B24: 15.65
B25: 20.9
B26: 18.84
B27: 17.41
A28: 22
A29: 20.81
A30: 21.96
A31: 21.16
A32: 60.17
A33: 37.17
A34: 61.52
A35: 62.2
A36: 19.1
A37: 20.52 | B37: of:=AVERAGE([.A1:.A10]) -> 34.661 | C37: of:=[.A1:.A10] -> 20.52 | D37: of:=MIN([.A1:.A10]) -> 19.1
A38: 24.09
A39: 24.53
A40: 22.53
A41: 25.15
A42: 24.05
A43: 24.27
A44: 22.97
A45: 28.79
A46: 30.8
A47: 61.33 | B47: of:=AVERAGE([.A11:.A20]) -> 28.851 | C47: of:=STDEV([.A11:.A20]) -> 11.7013754652083 | D47: of:=MIN([.A11:.A20]) -> 22.53
A48: 18.8
A49: 62.3
A50: 60.09
A51: 59.8
A52: 18.95 | H52: 1,0,0,1,1 | I52: 1,0,1,1,1 | J52: 1,1,0,1,1 | K52: 1,1,1,1,1 | L52: 1_0_0.3_1_1 | M52: 1_0_0.5_1_1 | N52: 1_0.3_0.3_1_1 | O52: 1_0.3_0.5_1_1
A53: 61.62 | H53: 1 | I53: 2 | J53: 3 | K53: 4 | L53: 5 | M53: 6 | N53: 7 | O53: 8
A54: 20.24
A55: 49.02
A56: 35.69
A57: 61.05 | B57: of:=AVERAGE([.A21:.A30]) -> 44.756 | C57: of:=STDEV([.A21:.A30]) -> 19.3224286488239 | D57: of:=MIN([.A21:.A30]) -> 18.8
A58: 52.12
A59: 23.91
A60: 22.88
A61: 30.29
A62: 62.19
A63: 22.04
A64: 23.35
A65: 23.35
A66: 27.25
A67: 25.02 | B67: of:=AVERAGE([.A31:.A40]) -> 31.24 | C67: of:=STDEV([.A31:.A40]) -> 14.0718418600172 | D67: of:=MIN([.A31:.A40]) -> 22.04
A68: 62.27
A69: 22.01
A70: 21.48
A71: 21.65
A72: 20.82
A73: 32.36
A74: 19.22
A75: 26.66
A76: 33.99
A77: 15.65 | B77: of:=AVERAGE([.A41:.A50]) -> 27.611 | C77: of:=STDEV([.A41:.A50]) -> 13.4556113449619 | D77: of:=[.A41:.A50] -> 15.65
A78: 23.55
A79: 22.92
A80: 21.43
A81: 21.88
A82: 36.41
A83: 23.23
A84: 20.9
A85: 22.33
A86: 30.63
A87: 21.42 | B87: of:=AVERAGE([.A51:.A60]) -> 24.47 | C87: of:=STDEV([.A51:.A60]) -> 5.03181434033049 | D87: of:=MIN([.A51:.A60]) -> 20.9
A88: 18.84
A89: 31.96
A90: 21.73
A91: 21.68
A92: 61.09
A93: 61.77
A94: 33.86
A95: 34.86
A96: 61.2
A97: 60.25 | B97: of:=AVERAGE([.A61:.A70]) -> 40.724 | C97: of:=STDEV([.A61:.A70]) -> 18.3148495913987 | D97: of:=MIN([.A61:.A70]) -> 18.84
A98: 22.99
A99: 26.47
A100: 22.38
A101: 60.98
A102: 23.58
A103: 17.41
A104: 21.22
A105: 22.39
A106: 20.36
A107: 24.26 | B107: of:=AVERAGE([.A71:.A80]) -> 26.204 | C107: of:=STDEV([.A71:.A80]) -> 12.454057081039 | D107: of:=MIN([.A71:.A80]) -> 17.41